{
  "modeResponseSchemaVersion": "alto9.io/mode-response/v1alpha1",
  "runtimeMode": "shadow",
  "packVersion": "1.0.0",
  "blocksWorkflow": false,
  "isAdvisory": false,
  "responseSummary": "Destructive production changes require an approved break-glass path. Shadow mode is active, so this workflow is not blocked by Control9."
}
